id,date,content,username,score,post_id,parent_id
lbxeis3,2024-07-04 09:44:37,awesome thanks.,Working-Effective-14,1,1duuqld,lbjaj68
laabhqb,2024-06-26 07:43:04,"No one gets ‘kicked’ to another airline randomly. Though Aer Lingus is not a full OneWorld partner, they do fly in connection with AA and BA. Just yesterday, I was on an AA/BA/Aer Lingus route returning from Glasgow all booked through AA. I couldn’t check in online - which is very often the case internationally, but had no issue checking in at the counter in Glasgow. You would have received or easily be able to find the record locators of all your flights when purchased or by reaching out to the airlines. If you are having trouble calling, even X/Twitter works.",barti_dog,3,1doj09u,na
le1riy0,2024-07-20 14:43:10,so her AA flight was canceled and they booked her standby on a partner.  And??,evilrob,2,1doj09u,na
le3a179,2024-07-20 14:43:10,"Nope, not canceled. Read the full post if you need more details, not going to spell it out again just for you.",Mysterious_Ad3949,1,1doj09u,le1riy0
laacoc9,2024-06-26 07:50:32,"Of course, it's a partner airline, although that didn't get revealed until this month . She booked her flight in January, on the American web site, fully paid for.  Like you, she cannot check in online. Gets to the counter in Chicago, and they tell her she's on standby. How far in advance do they overbook? American wouldn't help her, told her to talk to Aer Lingus. Aer Lingus said they can't do anything, had to get to the airport.

If this had all come out earlier she'd be on a Delta or United flight and not have these issues. 

There is a reason AA is at the bottom of customer satisfaction, even below Frontier and Spirit, shocked me too...",Mysterious_Ad3949,1,1doj09u,na
lacmkw8,2024-06-26 07:50:32,"Sorry for the frustration, but Aer Lingus didn't just pop into the One World equation recently. That's been in place for quite a while. You can purchase a ticket all booked via AA which is not all on AA metal. It seems that this is likely what you/she didn't catch somehow. I can't answer the question about being on stand-by with a confirmed ticketed reservation. Anyhow... I trust all turns out well.",barti_dog,3,1doj09u,laacoc9
l6dr6te,2024-05-31 05:14:59,"Yes

https://www.aa.com/i18n/travel-info/clubs/admirals-club-access.jsp",barti_dog,2,1d4egks,na
jny22ey,2023-06-13 08:34:55,"Find an alternative route, and call a s request to be out on that one",glockymcglockface,3,1480o1r,na
jny26dg,2023-06-13 08:34:55,I found one from Newark but because fare is more than double what i paid in February the agent said she can’t change my flight..,[deleted],1,1480o1r,jny22ey
lszqsmx,2024-10-21 19:59:31,File a chargeback through your cc company.,whiskey_tang0_hotel,1,1g7i6m8,na
lb1k670,2024-07-01 06:23:09,"Baggage trashers the world over don't care about your luggage! Sit by a window and watch sometime, you'll see them attempt to be gentle. If you get a chance to see what goes on out of the public view, i.e. where to transfer carts or delivery to the carousels, you'll see the real action. They toss, kich, jam up and otherwise do whatever they can to try and break your bag. A ""heavy"" tag pretty much guarantees abuse.

The bigger issue is that for most stateside airport, they don't work for the airline, they work for the airport authority. Airline blames the baggage trashers, baggage trashers blame the trashers at the last airport. Airline gets to refuse compensation because they don't own the process.",Mysterious_Ad3949,2,1ds86yf,na
le1r09c,2024-07-20 14:37:32,bye,evilrob,1,1ds86yf,na
jo0p06s,2023-06-14 02:33:27,Not a bulkhead... though may be technically listed that way. Congrats!,barti_dog,1,148c8s6,na
jo6c3f4,2023-06-14 02:33:27,"And then everything got delayed by Dallas weather and I grabbed a United flight at 2pm out of DFW rather than a 9pm AA flight.  Was an ""Adventure""",mmmmpisghetti,1,148c8s6,jo0p06s
jo5yg4u,2023-06-15 07:36:25,"A few major things to consider because there is no way to connect two reservations if purchased separately. Hope this helps…

1. If you’re checking bags, they will not be checked all the way through &amp; will be a nightmare getting out of security to claim &amp; recheck them for your next flight. 3 hours may not be enough. 

2. Because your flights are not connected, if there is a delay on your first flight, they will NOT provide accommodations during delay or automatically rebook for the next leg. This will also be a nightmare as the JFK-DOH flight on AA is very often delayed. I know from personal experience it has been delayed over 12 hours the last two days.

3. Schedule changes are very likely from here to December that may shorten that connection time which may cause you not to have enough time between connections. Then you have to worry about rebooking the connection which will probably cost because it is in a separate reservation. If it’s the same reservation they will accommodate free of charge.",Adventurous-Ad403,2,1498r94,na
jo61ri3,2023-06-15 07:36:25,"Yes, point #1 is something we’ve considered, but 2 and 3 are great insight, thank you!

Any major concerns you can think if we do the connection from DOH to GOI the following day?",redlipsandtaterchips,1,1498r94,jo5yg4u
kepdlqm,2023-12-24 12:47:00,"Can you do math? Is the cost of the ONLY trip you want to book fully with the miles more than $1000? 

Then Yes.

Otherwise just buy it. I don’t see how this needs to be asked to Reddit.",Justinackermannblog,1,18pcvla,na
i2gq8di,2022-03-29 01:53:16,I’m sure TSA is going to push it again. Can’t wait to fly without a mask,glockymcglockface,3,tqbzab,na
i2gqtwi,2022-03-29 01:53:16,"I sure hope not. With continual trend of lifting mandates, it's really losing the weight of importance, meaning people are going to be even less likely to comply. And, to the FA's credit (at least on my fligth from Calgary on Thursday), the guy sitting besid me left his mask off pretty much the whole flight and they didn't scold him at all. I was shocked.  Of course, it could be because every one of us on the flight had just tested negative in order to be able to board :)",barti_dog,2,tqbzab,i2gq8di
i2hnrqt,2022-03-29 05:46:29,"I flew over to Sydney on American last week. On the flight over about 60% of the business cabin didn’t have masks on once the lights went off, on the return the FAs were very strict even during meals. Needless to say I’m looking forward to the end of this stupid mask policy on planes, I hope they also drop the testing requirements.",woebundy,2,tqbzab,na
i2hobl7,2022-03-29 05:46:29,"I for sure join in being really glad we're continuing to move towards elimination of the mandates. Among the things that make absolutely no sense to me is that, for now, everyone is required to present a negative test to fly to the US. So you literally have a plane full of people who have no need to mask. And then, there's the uneven enforcement. I assume perhaps they knew -- or suspected -- there was someone on the plane who could give them all sorts of problems if they didn't enforce the mask mandate hard. That's the only explanation for continuing to be so ridiculous about it.",barti_dog,2,tqbzab,i2hnrqt
lrfioeg,2024-10-12 00:07:52,"Is it theoretically possible… Yes, but your quality of life won’t be great.",woebundy,3,1g19i1n,na
jd9h4bi,2023-03-23 04:03:19,Update the KTN in your profile. You will have to manually add it on to all existing reservations.,glockymcglockface,1,11yuhtv,na
jdticaa,2023-03-27 09:48:03,r/TSAPreCheck,MickIsShort4Michael,1,11yuhtv,na
jo5u1an,2023-06-15 07:00:27,You’re going to have to be more specific.  Look on seatguru,Plane_Tin_Can,1,14903lo,na
krefjow,2024-02-21 11:49:44,"You typically don’t as this is where travel insurance kicks in. At best in cases of mechanical or AA issues you’re given an airport food voucher and possibly a hotel voucher. 

Do you have the flight number and date? We can help by potentially showing if it was weather / atc, or AA related.",canfail,1,1aw1l6y,na
kreszw9,2024-02-21 11:49:44,"Do you use a credit card for travel insurance or do you buy from an insurance company? I’m considering getting an annual travel policy to avoid situations like OPs, but the prices vary so much that I’m not sure who has the best plan.",TrowTruck,1,1aw1l6y,krefjow
krhdl14,2024-02-21 11:49:44,It was flight 305 from STT to MIA on January 23. The STT airport is so small and understaffed they seemed to have no idea how to handle the situation.,TacomaCityGirl,1,1aw1l6y,krefjow
le5f2ox,2024-07-21 07:12:52,"Those are the rules unfortunately. If they just allowed it, everyone would be “sick” and change flight to cheaper day. It’s all based on the availability. Thanks for doing the right thing and not infecting others but it is what it is.",BocaRaton313,5,1e880np,na
le5j8ey,2024-07-21 07:12:52,Thank you- sometimes is hard having to pay for being responsable. It is what it is.,Primavez,2,1e880np,le5f2ox
jytujb9,2023-09-03 00:47:08,"You can submit a compliment. They do get trickled down to the employees.

https://www.aa.com/contact/forms?topic=#/",glockymcglockface,2,1683qnr,na
jz9smuk,2023-09-03 00:47:08,Awesome thank you for letting me know this!,IlDolceFarNiente,1,1683qnr,jytujb9
jm4atrq,2023-05-30 05:10:06,Nope. Children under the age of 18 don’t need a ID of domestic travel.,OkComparison9699,2,13v6l9z,na
jm4d8h4,2023-05-30 05:10:06,"So, on the website, it said I may need a birth certificate to verify age? Is that something they do? Also, thank you for answering.",weaponized_Soul,1,13v6l9z,jm4atrq
kjhyf05,2024-01-25 21:16:05,"That ridiculous and wouldn’t think that’s an issue if it’s fits in the bin and/or the seats empty… why make you check it?! Sometimes you just get stuck with someone on a power trip. We had a gate agent who didn’t want to let me board in Group 2 with a small suitcase cause the zipper to make it wider was open, my suitcase isn’t even the largest carry on, she was like if you can’t make it zip you will have to check it. Once on the plane there was no issue with bin space it fit fine and would have fit fine with it unzipped too. I was like is she just trying to feel powerful today?!",A-Gruns21,2,19dbolj,na
lpq2xcd,2024-10-01 06:40:20,"The reason for the delay is what matters. If it’s considered within control of the airline, then yes, you would be due food voucher — and hotel if extended overnight. This would typically include scheduled maintenance. If you are being denied these, then perhaps the issue was not maintenance. In the end, only the airline can tell you what they will do for you. And no, the DOJ is not the way to go. I think you meant DOT.",barti_dog,1,1fsxbsz,na
lpq3miq,2024-10-01 06:40:20,Thanks- I get the two mixed up. It was mechanical issues. ,PartyMap4088,1,1fsxbsz,lpq2xcd
jt4a85k,2023-07-23 21:25:27,It’s not just AA.,barti_dog,1,1573cai,na
jt4lmvk,2023-07-23 21:25:27,Hm. Not United or Delta. Not Alaska Air or Hawaiian Air. At least not for the last few trips I’ve booked.,the_real_blackfrog,1,1573cai,jt4a85k
joejx4f,2023-06-17 06:14:29,Yes,canfail,2,14b8xjn,na
l6l00bi,2024-06-01 13:03:09,"Yes you'll earn LP towards status. If you're on a challenge now, your status bonus will also add to the total LP of the booking.",Worldly-Mix4811,3,1d56awh,na
l6lb05b,2024-06-01 13:03:09,"You've made my morning. I scour the various sites and links but sometimes for these specific situations it can read a bit vague. You've settled my uncertainty.

Now to just have to deal with connecting via LHR for the 3rd trio this year!!",LARRYBREWJITSU,1,1d56awh,l6l00bi
lcan01i,2024-06-01 13:03:09,"Following up on this, just took the first half of the trip. Do you recall how long roughly it takes  before the points add to account? Or any guidance on a line in the sand before contacting the airline? Any advice appreciated.",LARRYBREWJITSU,1,1d56awh,l6l00bi
l0u6djz,2024-04-23 11:14:52,"A short connection is a roll of the dice — particularly in CLT where I regularly land early and end up waiting an inordinate amount of time for a gate. Not sure how requesting a cart works, but you can contact AA to find out. The rule of thumb is if your arrival somewhere is absolutely critical, book an extra day, not a 30 min connection for the last flight of the day around Christmas",barti_dog,2,1catdjq,na
l0u85y8,2024-04-23 11:14:52,I guess. Normally I would do that but I’m a medical student and have mandatory exams the day before so there really wasn’t any option for me though that’s all. Thanks for the advice though!,CarelessLab8035,1,1catdjq,l0u6djz
l0vvu3t,2024-04-23 21:18:56,"How far would the drive be out of CLT to where you're going?

Not saying this is the answer but maybe a desperate contingency.",LoneMav,1,1catdjq,na
l0vytro,2024-04-23 21:18:56,Unfortunately that’s not doable. My second flight is from CLT to SFO 😭 I would consider it if it didn’t take like 30 hours 😂,CarelessLab8035,1,1catdjq,l0vvu3t
l14gmw8,2024-04-25 07:39:32,"I've flown through CLT many time and regularly booked 35 min layovers. 4 out of 5 times its no problem at all as we've gotten in a few minutes early....but there is always that one time that makes me ask what I'm doing.

  
Fortunately in 15+ years of business travel, only one unexpected nightly lay over in CLT due to a missed connection.",MrRedManBHS,1,1catdjq,na
liet3z1,2024-08-16 22:28:07,"AFAIK, no. You get an ID90/75/50 for partner flights.",Worldly-Mix4811,1,1eti1vd,na
la5780k,2024-06-25 09:53:35,"I will just say “same”. This year, their system issue cost me my annual rewards (75000 points). I’ve been EP for YEARS and they do not give a 💩 about that.",LankyAstronomer4802,1,1dlytjy,na
kuwije9,2024-03-15 06:05:13,Buy the bag you want.  Photoshop the receipt date.  Submit receipt.  Keep new bag and use AA money to pay for it.,Pope_Dwayne_Johnson,3,1bewazv,na
kuzcnir,2024-03-15 20:29:45,Have always been able to submit receipt for new purchase and they pay it. I don’t buy fancy bags tho. They’ve replaced three $150 bags.,Phunlee,2,1bewazv,na
jo5uik5,2023-06-15 07:04:22,"Main Cabin Extra = a couple extra inches of leg room, a free drink, early boarding 
Preferred = closer to the front of the plane, but all else is the same, really

Personally, I would spend the $74 for the leg room or else spend nothing and take one of the freebies. But what that all’s worth is really up to you.",memeven,3,149ka9w,na
jo6e9xm,2023-06-15 07:04:22,Thanks for the info,jrb1204,1,149ka9w,jo5uik5
jo6rzcm,2023-06-15 11:59:06,28,shakenbaker23,2,149ka9w,na
jqa4rtk,2023-07-02 01:18:27,"If I am bringing only carryon, I try for the closest upfront and aisle. Lol. Get to immigration much quicker and out the door",dsjanecek305,1,149ka9w,na
jt6519w,2023-07-24 05:18:15,Looks like u have another good bit of LP’s to earn to get to the next level of the status challenge. I can’t imagine any extra effort for Gold could be worth it. The most you can expect I guess is seat selection and be very happily shocked if you get an upgrade. No intent to sound discouraging. Gold just isn’t much.Your LP’s per dollar on spend and travel is outlined here: https://www.aa.com/pubcontent/en_US/aadvantage-program/loyalty-points/index.html,barti_dog,1,157lhkq,na
lb5unza,2024-07-02 02:09:52,The cancelations aren't limited to AA. They're everywhere and most are 2 day cancelations. They're saying its due to July 4 travel but it seems really weird for the delays and cancelations to be at the same time. My daughter is stranded in FL right now. Her 4pm flight was canceled at 11:30pm last night and there are no flights available to NY until tomorrow.,Phoenx22,2,1dsyht8,na
l4l7jct,2024-05-18 19:54:37,Use the Iberia confirmation number and check directly on the Iberia site. Same thing happens when you book Etihad via AA.,IceCreamM0nster,2,1cuviha,na
l4la3cq,2024-05-18 19:54:37,"That’s what I did, and I do not see the seat assignments. Iberia is now saying that it’s typical for codeshare flights. And that I will be able to see the seat assignments at the checkin 24 hours prior to the flight. I am a bit skeptical…",seacity36,1,1cuviha,l4l7jct
l4lcpom,2024-05-18 20:38:53,Currently in Iberia hell myself on a trip. Booked a rewards via BA. BA showed my seats and Iberia didn't show them online and the app until the day before. I did contact Iberia who said they did confirm I had selected seats. Iberia just has a bad app and website.,PlumRepresentative95,2,1cuviha,na
l4luf6f,2024-05-18 20:38:53,Thank you for setting my mind at peace. Will stop wasting my time on talking to Iberia until the day before the trip.,seacity36,2,1cuviha,l4lcpom
l4nelz7,2024-05-19 04:57:19,The same also happens with Alaska when you book with them to codeshare with American.,Big_Dreams38,1,1cuviha,na
l4nubcx,2024-05-19 04:57:19,You will not see your purchased seats on either website until the checkin (at which point you will see them on AA)?,seacity36,1,1cuviha,l4nelz7
l7oopj1,2024-06-08 23:17:53,I have the exact same issue. Did you ever figure this out?,snollhole,1,1cuviha,na
l87ba84,2024-06-08 23:17:53,"No, the trip is in 2 weeks. What about you?",seacity36,1,1cuviha,l7oopj1
laoo73z,2024-06-08 23:17:53,I was able to see the seats which I had purchased when I checked in online.,seacity36,1,1cuviha,l7oopj1
kcosfps,2023-12-10 05:49:52,You’ll be fine,glockymcglockface,2,18ensuj,na
kcoshm6,2023-12-10 05:49:52,Thank you!!!,Netimaster,1,18ensuj,kcosfps
jwxxd7o,2023-08-20 09:40:31,"I’m EP and have requalified for next year, just depends. Usually out of smaller hubs I get upgraded 72 to 100 hours before about 90 percent of the time. Out of major hubs, not that often, especially if it’s a 319.",edt919,2,15vki6m,na
jxcumob,2023-08-20 09:40:31,"This is the correct answer, no matter the status. I'm a lowly gold member but I fly frequently out of a small regional airport, to a larger connector and into another small regional airport. I'm upgraded to first class at approximately 70% of the time. My trip last week, I was upgrade on both legs there and back.",MrRedManBHS,1,15vki6m,jwxxd7o
jww2ers,2023-08-20 02:19:43,"Platinum was once every 10 flights or so

Platinum pro has been about every other for me",Justinackermannblog,1,15vki6m,na
lgs7dh3,2024-08-06 23:14:16,Just wait until Debby is in Atlanta and you will be saying the same thing about Delta.,glockymcglockface,1,1elhrxi,na
lgsciub,2024-08-06 23:14:16,"
Flight is now delayed till 1350, CST. Mechanical problems, but this is truly the 3rd trip that ran through Dallas. Mechanical or weather.  Hundreds of planes just sitting around, you’d think they could scrap one up.",cayopaul,1,1elhrxi,lgs7dh3
jupi9ho,2023-08-04 10:16:42,"Haha, cmon. That flight canceled over three years ago. These flight credits have a 12mo expiration from original ticket date. All of that is before AA offered extensions on credit due to Covid restrictions. 

https://www.aa.com/i18n/customer-service/payment-options/travel-credit.jsp",canfail,2,15hlukw,na
jupizf8,2023-08-04 10:16:42,"Where in their cancellation does it note an expiration date?    Doesn’t.   Anywhere.   PS it’s two years, not twelve months.   Regardless, had I known, I certainly wouldn’t have let it expire.",Goonella,0,15hlukw,jupi9ho
jurd3ua,2023-08-04 21:41:51,"You can’t indefinitely hold flight credit. You didn’t read the expiration date of the flight credit, now you feel stupid, and you want everyone to be angry at American with you…

Nah.",Justinackermannblog,2,15hlukw,na
jus6u1t,2023-08-04 21:41:51,"No, I don’t feel stupid.  At all.   I’m actually a very successful business owner.  I don’t travel often, so I’ll plead ignorance to policy.   

I don’t think it’s transparent to write a blanket cancellation notice, and not explain the caveat RE the expiration date.   As someone who doesn’t fly much, I’d have no way of knowing this was their policy.",Goonella,0,15hlukw,jurd3ua
jo0purj,2023-06-14 02:40:32,yes. They'll happily sell you an upgrade. Either call or jump on the chat in the app.,barti_dog,3,148mafh,na
jo0yikh,2023-06-14 03:52:37,If there is an upgrade available it usually shows up on the app with a price.,tbonescott1974,3,148mafh,na
jo0ykyj,2023-06-14 03:52:37,Do you know where in the app?,Netimaster,2,148mafh,jo0yikh
jo53q36,2023-06-15 03:46:17,"like u/barti_dog said...don't be afraid to call. i've had good luck w/ contacting someone, and unless there's some major storm, i can get someone quickly w/o messing about. now...i'm old and have never minded picking up the phone lol.",Beer-_-Me,2,148mafh,na
livd6ew,2024-08-19 21:29:18,"Philly, huh? Remember US Airways, bought by AA. They once parked us at a unused gate, the expected one was full. AND no one emptied the luggage. One of the red caps said the belt get blocked, and he ran up and into the luggage path. 10 minutes later he came back out and said it empty, no luggage. 
There was a US Air office, 4 people sitting around shuttting the “sh**”, and we got them to go check it out. 45 minutes later, luggage. So this was over an hour we stood around waiting. 

Those people were used by AA to train the present staff. Not a lot of ambition to provide customer service, just a paycheck.",cayopaul,1,1evvane,na
livdngx,2024-08-19 21:29:18,"Two edits, conveyor belt. At Philly the carousels are in a separate building. Usually no problem. Also it shooting the “Shi*”, a Navy term.",cayopaul,1,1evvane,livd6ew
hyxmnnl,2022-03-02 01:18:17,My app currently shows the status tracker with loyalty points at the top.,barti_dog,2,t4258p,na
hyxnclz,2022-03-02 01:18:17,Ya mine just updated. Though the loyalty points show zero. I thought it was going to count Jan/Feb.,LewManChew,1,t4258p,hyxmnnl
hyy2f7s,2022-03-02 02:59:00,Mine is working !,Jayzeshazee,2,t4258p,na
l0zhc95,2024-04-24 10:06:27,It’s fine.,BocaRaton313,1,1cbmc6v,na
l1bc47h,2024-04-26 14:12:42,I have a flight coming up in may and I’m hoping it’s fine since it’s the first time traveling with AA for such a long time. What I’m most concerned about is delays but now idk if it matters since that new law is taking effect,Fabulous_Leader9862,1,1cbmc6v,na
le1r5zl,2024-07-20 14:39:15,cashapp?  with AA?  sounds like you got scammed by somone.,evilrob,1,1e047wq,na
le1r9wc,2024-07-20 14:39:15,nah it took a whole week to get the money back. I repurchased my ticket and all is good thank goodness 😅,Exotic-Scale-3616,1,1e047wq,le1r5zl
lfx3x9o,2024-08-01 10:58:32,Put your AA# on your booking under Finnair's Manage my booking on their website,Worldly-Mix4811,2,1eh4o8a,na
lg4gblu,2024-08-01 10:58:32,"Thanks, I got it done!",TripleMOutdoors,1,1eh4o8a,lfx3x9o
ldi8ez5,2024-07-17 04:32:05,"You had a year to get the credit issued. You waited. Doesn't matter whatever excuse you have. Once the ticket has expired, the information is purged from the system forever.",Worldly-Mix4811,5,1e4yd1n,na
ldi9xhz,2024-07-17 04:32:05,I spent that year helping with my sister. The reason i chose AA originally is they were best option to travel from my city to hers. Not so to where she was life flighted. Plus there was absolutely no information in the cancellation regarding time limits. And how am i supposed to know how long her recovery takes? I understand policies but when there is no information provided on cancellation how is someone supposed to know there is an expiration? A little understanding would be helpful.,Clarence-Tha-Dog,-5,1e4yd1n,ldi8ez5
lkfzeaz,2024-08-29 10:54:22,The two month old will sleep in the car seat - are you getting them a seat?,kdollarsign2,1,1f3ejo6,na
lkgzoow,2024-08-29 10:54:22,Not really they both hate car seats 😫,Esse739,1,1f3ejo6,lkfzeaz
lkhfqkg,2024-08-29 19:10:40,Why didn’t you have the option of picking your seats and opting/paying for bulkhead? I feel like that’s a standard part of every ticket I buy.,RhodyViaWIClamDigger,2,1f3ejo6,na
lkhgvmb,2024-08-29 19:10:40,I booked the flight late,Esse739,1,1f3ejo6,lkhfqkg
kwoh6jr,2024-03-27 02:30:20,OKC is a tiny tiny airport. AA has maybe 3 gates. Wouldn’t be surprised if the bathroom is a longer walk than the other gate.,glockymcglockface,3,1bod53o,na
kwohdgd,2024-03-27 02:30:20,Thank you! This is what I was hoping to hear.,LoPanArmy,1,1bod53o,kwoh6jr
kwpp8xz,2024-03-27 06:33:05,We just built a pretty large addition to 1 end and I’ve seen AA flight there. The main AA gates are at the other end from the new part so there is a small chance that you will have a 3-4 minute walk if you have to go from one end to the other.,tbonescott1974,1,1bod53o,na
lnsr10w,2024-09-19 05:15:31,"When you booked those flights, did the aircraft offer WiFi? AA is still adding WiFi to many of the regional jets. Many of them don’t have WiFi",glockymcglockface,1,1fk3lw9,na
lnsr8uz,2024-09-19 05:15:31,"Yes, the WiFi access point shows up.  When you try to connect to it nothing happens or you get to the initial splash screen and never are able to actually connect to WiFi.",BKOTH97,1,1fk3lw9,lnsr10w
lnvwtio,2024-09-19 20:22:35,"Credit where credit is due…my flight this morning from ATL to DCA had working WiFi.  It was intermittent and slow as molasses, but it was functional and I was able to do what I needed to do!",BKOTH97,1,1fk3lw9,na
lok39wy,2024-09-24 01:40:28,Good lord… it should just be free already….,dnuohxof-1,1,1fk3lw9,na
loou616,2024-09-24 01:40:28,I agree with that!  They should follow deltas lead here.,BKOTH97,1,1fk3lw9,lok39wy
lsp0bdu,2024-10-19 23:05:21,"There’s lots of info missing here, but I’m a going to assume you had a roller suitcase and on a regional flight or a plane configuration with the old luggage bins and probably wouldn’t fit.

If gate-checking a bag makes you this upset, then good luck with any other airline.",dnuohxof-1,3,1g735uv,na
