id,date,content,username,score,post_id,parent_id
lswxksf,2024-10-21 06:16:12,"As a parent traveling with a connection, I’d 100% want the bag to be checked.  Yes it’ll take an extra 10-15 mins at your destination, but when racing thru an airport with a kid to make a connection, why not let the airline deal with the bag?",yelldawg,1,1g735uv,na
k1n85rc,2023-09-22 08:28:24,No,glockymcglockface,2,16or8uq,na
k1q8iyv,2023-09-22 23:56:48,"Always worth a try, worst case take him to the admirals club",Howler777,2,16or8uq,na
k0w2py6,2023-09-17 05:12:45,Yes. PM me,aimusername,2,16kd657,na
iwlpdcw,2022-11-16 23:55:30,"Take the short layover if you want it, don’t if you don’t want to rush. That simple.

Your are the only person who can make that decision. That’s your $85 and if a quicker flight is worth $85 to you, do it. Airports are as bad an experience as you make them. 

I never run in airports, there’s always another flight… especially O’Hare and it has some cool views too.",Justinackermannblog,1,ywjoyz,na
jbbfhcl,2023-03-08 04:57:19,45 minutes in O’Hara sounds like bad news . I’d go with the one that gives you less anxiety.,UrbanBear555,1,ywjoyz,na
khnm5ws,2024-01-13 19:34:57,Most likely no,jblackbelt360,3,195fw7i,na
kho10bj,2024-01-13 21:57:13,"Unlikely… but they will be able to see when your plane landed, etc. and 27 minutes is enough time to make your way between AA gates usually. What happens a lot in CLT is arriving on-time or even early, but having to wait for the gate.",barti_dog,1,195fw7i,na
kho18bd,2024-01-13 21:59:01,Did u make it? 😁,barti_dog,1,195fw7i,na
kho1bxw,2024-01-13 21:59:01,made it with a few to spare!,Late-Tangerine-4303,6,195fw7i,kho18bd
khp4duj,2024-01-14 02:10:50,"More than once I've sat on the tarmac at Charlotte waiting for a gate to come into, and watched my next flight take off without me...",MrRedManBHS,1,195fw7i,na
l4sv5e7,2024-05-20 07:10:48,What does their application say?,glockymcglockface,1,1cvrw2b,na
l4v4nxf,2024-05-20 20:08:41,Ask Scottie Scheffler,Suspicious-Post-5866,1,1cvrw2b,na
l4v5c4l,2024-05-20 20:08:41,Who is that?,Working_Substance395,1,1cvrw2b,l4v4nxf
l4wnpih,2024-05-21 02:04:01,That's not on your record,entechad,1,1cvrw2b,na
kwt9chl,2024-03-27 23:42:15,"If you see a price drop for the same itinerary, you can always contact the airline and ask them to reprice the ticket and issue a trip credit for the price difference. 

Edit: Has to be main cabin to main cabin. You can't request this based on a Basic Economy fare.",barti_dog,3,1bp4npv,na
kwuzcm9,2024-03-28 05:20:55,Use google flights. Set up price alerts. It’s simple and easy to set up and track.,[deleted],1,1bp4npv,na
kx91b0u,2024-03-30 21:31:16,"Ticket prices rarely go down over time.  Usually go up. You can always rebook main cabin to another main cabin fare, even if different times/connections, and receive a credit for future travel.",yelldawg,1,1bp4npv,na
l6dq99b,2024-05-31 05:09:41,Go complain to AA on their website,glockymcglockface,2,1d4dg8q,na
l6gvkkp,2024-05-31 20:40:38,Welcome to Miami. It is just how it is.,SKULLDIVERGURL,0,1d4dg8q,na
lbiwq4h,2024-07-04 08:07:58,"Well, I’d kinda be a little worried because about your first flight because even though check in does indeed open at 4 am, you can guarantee there is going to be a long line at check in to get on your particular flight with people trying to check in their bags. So if you are in line at 4 am, check in for your flight closes 45 minutes before your departure to Charlotte. So you’d have 15 minutes to stand in line, get your bags checked in, go through security and make it to your gate at least 15 minutes before departure. Personally, I wouldn’t risk it so my advise is to get to the airport at 3 am and just go to security. You can gate check your bags to Barbados from there.",One-Imagination-1230,6,1duqt5i,na
lbqgf4f,2024-07-05 20:29:43,You will be fine as long as you don't roll into the airport at 4:30am.,jab121212,1,1duqt5i,na
jod6h4z,2023-06-17 00:11:50,They went dark for the protest. No idea when they’ll be back,glockymcglockface,1,14agadj,na
joa9rpn,2023-06-16 07:07:47,Probably went private like so many subs,digitalrebel89,7,14agadj,na
joaehpw,2023-06-16 07:07:47,"It should come back by now as they’re only hurting their community and pushing people to other similarly named subreddits. 

If this one didn’t exist I’d be surprised American_Airlines wasn’t created.",canfail,9,14agadj,joa9rpn
joang0k,2023-06-16 09:00:38,"I’ve had people text me asking if they got banned from that sub, that’s how much people are missing it already 😂😂😂😂",aimusername,3,14agadj,na
joaxmd3,2023-06-16 09:00:38,"I’m sorry HAR,D but what else am I supposed to do on my layovers 😂😂😂",Howler777,2,14agadj,joang0k
joaneu2,2023-06-16 09:00:21,"Wondered that, too!",LankyAstronomer4802,2,14agadj,na
joayaaf,2023-06-16 10:34:16,It was weird. R/delta also disappeared but United airlines was never impacted.,yelldawg,2,14agadj,na
kr1rv6h,2024-02-19 05:48:04,Was this a return flight or connection where you changed or missed the outbound flight?,kgvc7,1,1au39fx,na
kr1vfxz,2024-02-19 05:48:04,It was the first of 2 connecting return flights.,Cheezburgerwithfries,1,1au39fx,kr1rv6h
kr2vgxy,2024-02-19 10:08:57,"Question. How did you pay for this flight? Was it paid for with a credit card? If so you may have “trip interruption” and “trip cancellation” insurance built into the card as a perk. Or was this trip booked and paid for with award mileage? If any of the above, you shouldn’t have any issues with refunds. Now if your credit card has trip insurances, you will have to file with your credit card company, and not the airline.",[deleted],1,1au39fx,na
kcn0948,2023-12-09 23:04:31,"No, only main cabin extra.

Yes, unless you have an AA cobranded card, status, or you bring the bag through security and gate check it when they call for it (not guaranteed, but seemingly happens on 99% of my flights)",consummatefox,1,17q0pv5,na
kh7jfuw,2024-01-10 22:21:42,If you buy with AA branded CC then yes via branded CC spend. Otherwise no,[deleted],1,1932wmj,na
kh7sw17,2024-01-10 23:22:07,"What counts are Loyalty Points. You would get LP's for the purchase price paid on your AA credit card, but the miles themselves are just miles, not loyalty points.",barti_dog,1,1932wmj,na
kgw9it8,2024-01-08 22:08:05,It’s fine,glockymcglockface,1,191knnf,na
kgwb6u0,2024-01-08 22:18:54,"Maybe? Depends on the dimensions and if you’re intending to bring another item (I.e. is this your carry-on or your personal item?)

But bags like this are not particularly great because - no structural integrity, it can’t stand on its own or protect its contents. What are you carrying in it? A pillow or blankets (would be fine). If you’re going to use it to have a laptop+purse+ makeup + yada yada, if it gets tipped over the contents will fall out.",[deleted],1,191knnf,na
kgwe24z,2024-01-08 22:18:54,"Hey! so the bag has a zipper and i wanted to use it as a personal item. i wanted to put my essentials in there like my blanket, small items, laptop, passport, (and probably some extras i might not be able to fit in carry on).  I was just stressing bc the bag doesn’t met the  18 x 14 x 8 inches requirement, but i’ve seen people bring big duffle bags as their personal item and they were let through so i was just curious. For reference the bag is 22 x 14.5 x 13.",anittamaxwynn1,1,191knnf,kgwb6u0
ks4hi9y,2024-02-26 05:23:19,I wouldn’t worry about that. Like at all,glockymcglockface,0,1azy8ve,na
ks4hy7q,2024-02-26 05:23:19,Have you traveled with a stroller like that?,sofiavallejo,0,1azy8ve,ks4hi9y
ks4u9qn,2024-02-26 06:38:48,So multiple times I’ve had no problems but once in Dallas an agent refused to let me gate check it and made me check check it stating it was overweight (was not put on a scale). Depends on the agent…hopefully you have nice ones. Good luck!,EWigs9,0,1azy8ve,na
jdkyh1v,2023-03-25 11:42:23,"I'm only 5'11 and NO. NEVER. No apologies. Have also been asked to switch. It's usually someone whose spouse/travel companion has access to MCE and they're hoping you'll take 36E because they would ""love to sit together."" Noise cancelling headphones are the best. ""Sorry I can't hear you.""",[deleted],1,10phas9,na
jod0wvg,2023-06-16 23:33:28,omg i hate when i pay for a window seat and some mom and their kid ask if we can switch so their kid can look out the window. hell noooo! lmfao,[deleted],1,10phas9,na
joalsa7,2023-06-16 08:46:43,Nope. If you split the reservation he will no longer get any of your travel benefits. If you have status you will still get upgraded even if he does. You can also add him to the upgrade list at the airport as well,OkComparison9699,2,14aae2f,na
joh7kqg,2023-06-17 23:12:02,Thanks y’all!,thecodymac,1,14aae2f,na
ka30uz8,2023-11-21 07:21:15,Call and cancel the second leg. You will likely get a flight credit.,glockymcglockface,1,1801qan,na
ka4vavf,2023-11-21 07:21:15,"I’m concerned they might reprice the trip to end in Miami. This close to the departure, the new price will be like buying a last minute ticket, which could be a much higher fare. OP can use the “change flight” option to test if it will cost more before deciding whether to cancel the last leg.

If it ends up costing more, I would just leave it alone. As long as OP doesn’t make a habit of skiplagging, likely there will be no consequence to doing it just this once.

Also, it probably goes without saying, but do not check any bags on this flight. Also there is a risk if OP is not in an early boarding group, that it’s a full flight so they should understand there’s a risk of being required to gate check a carryon.",TrowTruck,1,1801qan,ka30uz8
ka30ziq,2023-11-21 07:22:05,"I did this a few months ago.  No issues.  But once you land in MIA and know that you are not going to use your last leg, let someone at AA, I did so at the AC in DFW, that you are abandoning your final leg.  That way they can give the seat away without much hassle.",jab121212,1,1801qan,na
ka3gdyl,2023-11-21 09:09:16,Thanks everyone.,deluxxcorp,1,1801qan,na
jxib3mz,2023-08-24 11:27:09,It’s the Panasonic Wi-Fi which stops about 90m out from 16k feet. Hopefully I’m corrected but I want to say $19 for the entire flight but don’t quote me.,canfail,1,15zpjj7,na
jxib8ht,2023-08-24 11:28:19,"I was just on this a bit ago. It was absolutely terrible and it couldn’t connect. Was in biz and FA said that if too many people log on at same time, it grinds to halt. I got my money back. If it’s the 772, good luck. I had planned on working to no avail.",BocaRaton313,1,15zpjj7,na
l0fzzkq,2024-04-20 21:01:48,They should reimburse the hotel cost (when a reasonable amount). They likely won’t reimburse the Uber because wherever they were giving vouchers likely had a shuttle. But it doesn’t hurt to ask.,yelldawg,1,1c8l9ja,na
l2hi539,2024-05-04 10:04:28,I fly regularly (every week). I always pick the highest and have only ever been offered twice in 8 years. I don’t think you can get more than what’s offered in the app but they’re also not trying to use you if they can avoid it. Don’t bank on it but you’re definitely lucky if they pick you.,Ok_Plantain_9384,1,1cjook2,na
l2jjtad,2024-05-04 21:45:25,You can’t negotiate up. You get what you choose in the app,barti_dog,1,1cjook2,na
kk6cxvj,2024-01-30 06:56:46,"As per a contentious recent convo in this subreddit, another user tried and was not granted to get an extension. 

I’ve gotten extensions before but I’m a 1.4 milly miler so YMMV. 

If these are FLIGHT CREDITS They must be **traveled** by expiration  date (and by you and you alone).  If they are TRIP credits they can be used for a trip anytime in the bookable future (and can be used to book travel for someone else). 

But if you’re literally not going to travel in the foreseeable future, then you may be out of Luck.",[deleted],1,1ae7yib,na
kk7jxvl,2024-01-30 11:34:15,"How much is each ticket worth?

If these are what AA calls “flight credits,” here’s an example of how you can extend at least some of the value of these:

 * Example, you have a “flight credit” worth $500.
 * Find the cheapest one-way flight between any two cities. I believe it can’t be a basic economy fair, but main cabin is fine.
 * After booking, AA will issue you a trip credit for the difference in price. This credit will be good for one year from the date it is issued.
 * If you’re not going to use the one-way flight, cancel the one-way flight.

You’ll likely get the one-way flight price back in a flight credit with the origins expiration date, but the rest of the money will be on a new credit that you have a whole other year to use.",TrowTruck,1,1ae7yib,na
litdnx7,2024-08-19 10:40:39,It can and it does. What route? Likely a high demand route and a hundred people have an alert set. r/awardtravel promotes that and they have over 500k subs. So millions of people are looking for routes.,glockymcglockface,1,1esubb4,na
liv9uls,2024-08-19 10:40:39,"Oddly enough this is Bozeman to a small airport in the east.  Flight is over half empty and is just over 30 days out.  It varied between 70k and 45k (points) for a one way Biz Class.  It has stabilized within the range of 46 - 66.  5 minutes ago it was 46 and now it is 48.5.  But last week it was bouncing around all over the place from 46.5 to 80, constantly.  I just don't get what the pricing algorithm is looking at.  But, I swear they know when you are in there checking routes and instantly jack rates up.  That seems highly unfair.  I could see day to day changes but this is pure price gouging.  However, if you are bound and determined to beat them at their own game and stick with it you can beat them at your own game, it just takes time and effort.",toddreg,1,1esubb4,litdnx7
j9076gf,2023-02-18 13:41:59,Noted. Non essential.,kgvc7,1,1156xuu,na
limp7c5,2024-08-18 06:18:54,"My understanding is that you basically find a vacancy and apply for it.  There might be a means of lateraling a person into a position, but it is worlds apart from the union system.  To my knowledge there is nothing prohibiting a transfer to a lower role, but it’s usually avoided/looked down upon.",Top-Employ-8907,3,1eu8jj3,na
limpxxn,2024-08-18 06:18:54,Thank you so much that really helps.,Striking-Pay-9257,2,1eu8jj3,limp7c5
hyuj2ws,2022-03-01 08:08:51,"You should stress that people should obtain travel insurance if there is nonrefundable fares, hotel charges, etc., in their vacation plans. If you can't afford the loss, insure it.",vegassatellite01,4,t3se9x,na
hyv2yo6,2022-03-01 08:08:51,Thanks! I addressed it,glockymcglockface,1,t3se9x,hyuj2ws
